article_title,article_url,source_domain,article_snippet,source_topic,timestamp,full_article,article_url
The Country With the Highest Retirement Age in the World Will Surprise You. Here‚Äôs How the U.S. Compares,https://www.investopedia.com/country-with-highest-retirement-age-11741440,investopedia.com,"Libya has the highest official retirement age in the world, and Denmark will soon join it. The United States isn't too far off and stands to...",Retirement planning,2025-07-30T14:14:53,"The Country With the Highest Retirement Age in the World Will Surprise You. Here’s How the U.S. Compares
By Isabel O'Brien
Isabel O'Brien
Full Bio
 
 
Isabel O’Brien is an experienced business journalist who specializes in private equity, infrastructure, and financial misconduct.

Learn about our editorial policies 
 Published July 27, 2025
Fact checked by Vikki Velasquez
A person seated outdoors at a table near a white building with blue windows surrounded by greenery
People must reach 70 years old to be of full retirement age in these two countries.
Johner Images / Getty Images
7 Reasons You Haven’t Received Your Tax Refund

Close
Denmark will soon be tied with Libya to have the highest official retirement age—meaning the age when a person can access their full government pension or social security check—in the world.

Libya’s current official retirement age is 70.
1
2
 And, following a law passed this spring, Denmark will soon follow suit, raising the age for those born after Dec. 31, 1970, to claim full pension benefits to 70 years, up from 67. The change will be implemented gradually through 2040.
3

Key Takeaways
Denmark will soon be tied with Libya as having the highest official retirement age, at 70 years old.
Other countries with high retirement ages include Australia, Greece, Iceland, Israel, Italy, the Netherlands, Spain, and the United States.
Countries with low official retirement ages often have high effective retirement ages, meaning people tend to work until their mid-60s regardless of where they live.
While the United States will avoid a raise in the retirement age this year, from 67 years old, the Republican Party has continually proposed this during budget talks.
Even before the law was passed, Denmark was tied with the likes of Australia, Greece, Iceland, Israel, Italy, and the Netherlands for the second-highest retirement age. The United States followed in third place, with an official retirement age of 66.7 years old, and Spain in fourth place with 66.5 years.
2

When to Stop Working
There are a few reasons why retirement ages are increasing worldwide. First, longer life expectancies are straining pension systems.
4

This was the key driver behind Denmark’s raising of the retirement age, with the country tying its official retirement age to life expectancy since 2006.
5
 That is subject to change, though, after this final hike.

“We no longer believe that the retirement age should be increased automatically,” Social Democrat Prime Minister Mette Frederiksen said. “[Our party] can’t just keep saying that people have to work a year longer.”
3

Second, aging populations due to declining fertility rates have meant that fewer young workers are supporting more and more retirees, risking the longevity of pension systems.
4

And finally, fiscal pressure from unbalanced budgets and inflation has forced governments to rein in spending on public pension systems by raising the age of retirement to contain costs.
6
7

Legal vs. Effective Retirement Age
Nominally, these retirement ages are high compared to countries like India, Indonesia, and Turkey, which all have retirement ages set in the 50s. Saudi Arabia has the lowest retirement age in the world, with some workers being able to access their full pension benefits by 47.
8

Few people in these countries, though, actually stop working so young. In reality, these countries’ effective retirement ages, or the average age when people tend to stop working, all lie in the mid- to late 60s.
9

“There is no mandatory retirement age,” says Doug Carey, CFA, the founder and president of WealthTrace, a software provider for retirement planners. “Many people continue working well into their 70s [despite official retirement ages].”

Related Stories
4 Essential Tips for Retiring Comfortably With a Pension
Man holds pension check. 
What Does It Mean To Truly Retire?
A person in an apron holding a tablet reaching for an item on a shelf in a workshop filled with pottery and tools
The Case for the United States
The effective retirement age in the United States is actually much younger than the legal retirement age. If you want to access your Social Security benefits in the U.S., you’ll have to wait until you’re 67 if you were born after 1960. Those born in the years 1943 to 1954 were able to access their benefits by 66.
10
 However, according to MassMutual, most people in the U.S. tend to retire by 62.
11

Despite Americans’ obvious preference for earlier retirement, there have been ongoing efforts to raise the retirement age by the Republican Party. For example, last year, the Republican Study Committee—a group that includes roughly 80% of all Republican lawmakers in the U.S. House of Representatives, as well as the entirety of House Republican leadership—suggested that the Social Security Administration should raise the full retirement age to 69 by 2033.
12
13

This proposal did not make its way into the 2026 budget reconciliation bill, frequently dubbed the “Big Beautiful Bill,” though reforms are not off the table in the near future.
14
 The Social Security Board of Trustees recently reported that the program expects to run out of money a year sooner than previously reported, in 2034.
15

The Bottom Line
At the end of the day, retirement ages are likely to keep going up, not down.

“Retirement ages are increasing worldwide,” says Carey. “Most people need to start planning for a longer work life.”

To do so, Carey recommends people maximize their retirement contributions, delay their Social Security or pension benefits for as long as possible, and budget for a longer life.

“Don’t assume you will pass away at your life expectancy. Most people should assume they will live to at least 90. Have a financial plan built for you and add in healthcare inflation and potential long-term care costs,” he says.",https://www.investopedia.com/country-with-highest-retirement-age-11741440
The 10 worst U.S. states to retire‚Äî6 are in the South,https://www.cnbc.com/2025/07/26/worst-us-states-to-retire-bankrate.html,cnbc.com,"Factors like affordability and weather may make these states unattractive to retirees, but they could be right for you based on your...",Best states retire,2025-07-30T14:15:12,"The 10 worst U.S. states to retire—6 are in the South
Published Sat, Jul 26 20259:00 AM EDT
thumbnail
Kamaron McNair
@in/kamaronmcnair/
@kamaronmcnair
Share
Share Article via Facebook
Share Article via Twitter
Share Article via LinkedIn
Share Article via Email
Female tourist sits on the relaxing porch during an overnight stay at Maison Madeleine, a restored 1840's French Creole cottage on the edge of Lake Martin swamp, Lafayette, Breaux Bridge, Louisiana
Tourist sits on the porch during a stay at Maison Madeleine, a restored 1840_s French Creole cottage on the edge of Lake Martin swamp, Lafayette, Breaux Bridge, LouisianaWanderluster | E+ | Getty Images
There are a number of factors to take into consideration when choosing where you want to retire, including the lifestyle you want and your financial situation.

In addition to looking for options that meet most of your needs, you’ll want to consider any major downsides or trade-offs you’d have to make, such as a lack of accessible health care or a high cost of living.

Financial services website Bankrate recently ranked all 50 states based on 15 metrics, including affordability, health care and weather, to determine the best and worst places to retire in the U.S. The study used data from a variety of sources, including the Council for Community and Economic Research, the National Oceanic and Atmospheric Administration and the U.S. Department of Health and Human Services.

The metrics were weighed according to survey responses gathered by Bankrate in May 2025 on what Americans say are their top priorities for choosing a retirement destination. As a result, affordability, weather and neighborhood safety influenced overall scores the most.

Here are the 10 worst states to retire, according to Bankrate, where you may have to compromise when it comes to cost, safety and access to health care:

Louisiana
Texas
Oklahoma
Arkansas
Nebraska
Alabama
Kansas
California
New Mexico
Florida
Weather also played a significant role in landing several of these states at the bottom of the overall rankings. Louisiana ranked No. 39 for weather and Texas came in at No. 47 in that category.

“Natural disasters really degraded the scores of almost every state across the Gulf. Texas, Florida — even states that you really think about as primary retirement destinations,” Stephen Kates, a certified financial planner and Bankrate financial analyst, tells CNBC Make It. “They didn’t do as well in the weather category because of their propensity to have hurricanes and other natural disasters.”

Personal preference matters
It can be helpful to consider these rankings and the metrics used to determine them, but ultimately, the best place for you to retire will depend on your personal preferences.

Retiring in Louisiana or Oklahoma may look challenging based on these metrics, for example, but if that’s where your family lives and you want to be close to them, it may be worth planning ahead and figuring out how to live well there, despite potential drawbacks.

If living in a tax-friendly state is important to you, Wyoming may be your best fit, Kates says. The state came in at No. 3 overall and No. 1 for tax-friendliness. But you’d be giving up other potential amenities.

“You pay very little state taxes, but you have little access to some of the other things that you may want,” he says. “Wyoming is not great for arts and entertainment — it’s a big, more rural place.”

Conditions can also vary greatly within a given state when it comes to metrics like neighborhood safety. State-level data can be a good place to start, but you may need to dig deeper or visit in person to determine if an area is right for you, especially if you’re considering a big state like California or Texas, Kates says.

“Where you live in California or Texas or Florida, or any state, is going to matter because we’re aggregating a lot of data,” he says. “If you live in Los Angeles, it’s going to be very different than if you live in Sacramento or La Jolla; if you live in Dallas, very different [than] Houston.”

Planning for retirement is ‘a lot more than just putting a pin on the map’
You may choose not to relocate in retirement, or prefer to wait until later on to make a move. As people live longer than they used to and thus may be retired longer, it’s wise to think about your retirement in phases, Kates says.

“It’s a lot more than just putting a pin on the map and saying, ‘This is the place,’” he says. “If you’re going to live in retirement for 25 or 30 years, there’s going to be phases of that. And how you figure that out is extremely relevant.”

If you want to dedicate time to traveling in your early retirement years, it may not make sense to also try to move your home base during that period. But a decade or so later, you may be more interested in settling down somewhere new.

Kates calls these the “go, low-go and no-go” phases of retirement, alluding to idea that as you get older, you’ll likely want or need to slow down.

Want to stand out, grow your network, and get more job opportunities? Sign up for Smarter by CNBC Make It’s new online course, How to Build a Standout Personal Brand: Online, In Person, and At Work. Learn from three expert instructors how to showcase your skills, build a stellar reputation, and create a digital presence that AI can’t replicate.

Plus, sign up for CNBC Make It’s newsletter to get tips and tricks for success at work, with money and in life, and request to join our exclusive community on LinkedIn to connect with experts and peers.",https://www.cnbc.com/2025/07/26/worst-us-states-to-retire-bankrate.html
Retirement,https://smartasset.com/retirement/articles,smartasset.com,"July 29, 2025 Knowing what the average Social Security check is at age 64 can help you decide when to retire and create a plan for your income in retirement.",Retirement income,2025-07-30T14:15:31,"Retirement
Does Contributing to a 401(k) Reduce Taxable Income?
August 6, 2025If you have a retirement account, you are probably wondering, does a 401(k) reduce taxable income? The short answer is yes, contributing to a traditional 401(k) plan does indeed reduce your taxable income for the year of contribution. When you make contributions with pre-tax dollars, the money goes into your retirement account before calculating income… read more…

How Much Should I Have in My 401(k) at Age 60?
August 6, 2025By age 60, retirement is no longer a distant goal, it is just around the corner. For many, it begs the question: how much should I have in my 401(k) at age 60? Many financial experts recommend having saved eight times your annual salary by this point to help support a comfortable retirement. At this… read more…

I Have $1.2 Million in an IRA and Will Receive $2,000 Monthly From Social Security. Can I Retire at 67? 
August 6, 2025If you’re sitting on $1.2 million in a traditional IRA and expect to receive $2,000 per month from Social Security, you may be wondering if that’s enough to retire at age 67. The answer, as always, depends on several factors, such as how long you expect to live, how much you’ll spend and how you… read more…

How Much Should I Have in My 401(k) at Age 40?
August 5, 2025By age 40, many people begin to evaluate whether their retirement savings are on track. While there’s no single benchmark that fits everyone, national data offers a reference point. Factors like income, years in the workforce and access to retirement plans all influence how much someone may have saved by this stage. However, according to… read more…

How Much Should I Have in My 401(k) at Age 35?
August 5, 2025You may be well into your career by age 35 but still years away from retirement, making it a common checkpoint for assessing your 401(k) progress. According to Fidelity, the average 401(k) balance for people in their mid-to-late thirties was $73,200 at the end of 20241. But averages don’t tell the whole story: how much… read more…

Why Do Financial Advisors Offer Clients Annuities?
July 31, 2025Some financial advisors promote annuities because they offer tax deferral, guaranteed income, or principal protection. But while these features can support retirement planning, annuities often carry high fees and commissions that can influence recommendations. Knowing why advisors recommend annuities can help you ask better questions and evaluate how this option could fit into your financial… read more…

Breaking Down Inflation Under Trump vs. Biden
July 31, 2025Inflation under Trump and Biden reflects two very different economic backdrops. During Trump’s first presidency, inflation remained modest, with rates generally staying below the Federal Reserve’s 2% target. Under Biden, inflation surged beginning in 2021, influenced by supply chain disruptions, stimulus spending and rising energy costs. Forecasts for a second Trump term suggest that his… read more…

What Is the Average Social Security Check at Age 66?
July 30, 2025Social Security is a key source of income for millions of retirees. And knowing what the average Social Security check looks like at age 66 can help you plan more effectively. For those born before 1960, their full retirement age (FRA) is between 66 and 67. While those born after 1960 have an FRA of… read more…

What Is the Average Social Security Check at Age 65?
July 29, 2025For many Americans, Social Security is a foundational source of income in retirement. And knowing how much you can expect to receive, such as what the average Social Security check is at age 65, can help you plan ahead. It’s also important to note that claiming Social Security at 65 or earlier will result in… read more…

What Is the Average Social Security Check at Age 64?
July 29, 2025Knowing what the average Social Security check is at age 64 can help you decide when to retire and create a plan for your income in retirement. Collecting Social Security at 64 does mean you’re claiming benefits before your full retirement age (FRA), which still means a permanent reduction to your monthly benefit. But if… read more…

What Is the Average Social Security Check at Age 63?
July 28, 2025Social Security is a key source of income for many retirees. With that in mind, it’s useful to know what the average Social Security check may be at age 63 so you can better plan for retirement. It’s also important to understand that while you can begin collecting Social Security as early as 62, claiming… read more…

What Is the Average Social Security Check at Age 70?
July 24, 2025For many Americans, Social Security represents a significant part of their average retirement income. By age 70, most people have either already claimed their benefits or are about to. If you’ve waited until now to claim, you’ll receive the maximum possible monthly benefit thanks to delayed retirement credits. Regardless of when you claimed, knowing what… read more…

What Is the Average Social Security Check at Age 67?
July 24, 2025Planning for retirement means figuring out how much income you’ll have. And for many Americans, Social Security is a big part of that. Your monthly benefit at full retirement age (67) depends on your work and earnings history. A financial advisor help you determine when to start and build a retirement plan that fits your… read more…

What Is the Average Social Security Check at Age 62?
July 24, 2025Social Security benefits are a key part of retirement income for many people. You can start collecting as early as age 62, but doing so will lower your monthly payment for life. It’s important to know how early retirement affects your benefit and what the average payout is at 62 before deciding when to start.… read more…

Is Your Pension Considered Earned Income? Tax Planning Rules
July 23, 2025When it comes to tax planning rules, many retirees often ask one question in particular: is a pension considered earned income? The short answer is no—pension income is generally not classified as earned income for tax purposes. Unlike wages, salaries, tips and self-employment earnings, which qualify as earned income, pensions fall into the category of… read more…

HSA vs. Roth IRA: Pros and Cons for Retirement
July 17, 2025The comparison between HSA vs. Roth IRA for retirement planning isn’t about choosing one over the other. Rather, it’s about understanding how each might fit into your comprehensive financial plan. Your health needs, current tax situation and retirement timeline are all relevant in determining the optimal strategy. As healthcare costs continue to rise and represent… read more…

What Is a Miller Trust and How Does It Work?
July 10, 2025For individuals who require long-term care but earn too much income to qualify for Medicaid, a type of trust called a Miller Trust can help bridge the gap. Sometimes called a qualified income trust (QIT), this type of trust allows individuals to meet Medicaid’s income requirements while still using their funds to cover care-related expenses.… read more…

Is Trump Going to Raise the Retirement Age?
July 9, 2025While President Donald Trump has consistently pledged not to raise the retirement age, several influential Republican factions have promoted adjustments that would shift that timeline. And it’s not entirely up to the president. Even if Trump sticks by his prior commitments, a higher retirement age remains a possibility. Any change could have sizable effects on… read more…

How to Convert a 529 Plan to a Roth IRA
July 2, 2025A new opportunity has emerged for families with leftover college savings: converting 529 plan funds to a Roth IRA. Previously, withdrawing 529 funds for non-educational expenses meant facing income tax and a 10% penalty on earnings, creating a dilemma for families whose children received scholarships or chose not to attend college. But thanks to the… read more…

Can You Stop Social Security Benefits and Restart Later?
June 25, 2025Deciding whether to stop Social Security and restart it later depends on your age and how long you have been receiving benefits. If you have been on Social Security for less than 12 months, you can apply to withdraw your application. This will essentially erase the claim. For those who have reached full retirement age… read more…

Cross-Border Retirement Planning: What You Need to Know
June 18, 2025Cross-border retirement planning can introduce unique financial questions for those living, working or retiring across more than one country. Tax rules, pension portability, healthcare access and currency risk can all affect retirement income and expenses. Planning ahead can help you account for differences in tax treaties, investment regulations and residency requirements. Whether you are moving… read more…

What’s the Ideal Age to Retire for Longevity?
June 18, 2025Retirement is a major life decision and the timing can affect more than just your finances. While having enough money is important, other factors—like your health, mental well-being, social life and the type of work you do—also matter. Some research shows that when you retire may impact how long you live as well as your… read more…

401(k) Asset Allocation By Age: Examples and Charts
June 13, 2025As you progress through your career, your income investment strategy should evolve to balance growth opportunities with risk management. In your 20s and 30s, you might embrace more aggressive allocations. This means a higher percentage of stocks to capitalize on long-term growth potential. By your 40s and 50s, there’s a gradual shift toward more conservative… read more…

401(k) Millionaires by Age Group
June 12, 2025Becoming a 401(k) millionaire represents a significant milestone in retirement planning. According to recent data, the average age at which individuals attain this status is 59 years old, typically after 26 years of consistent contributions to their retirement plans. The length of time typically required to become a 401(k) millionaire underscores the importance of long-term… read more…

What’s Considered an “Aggressive” 401(k) Strategy?
June 6, 2025An aggressive 401(k) strategy typically involves allocating a larger share of retirement contributions to stocks, particularly those with higher growth potential. This approach aims to maximize long-term returns by accepting greater short-term volatility. It’s often favored by younger investors who have more time to recover from market downturns. Asset choices might include small-cap funds, emerging… read more…",https://smartasset.com/retirement/articles
